<schema xmlns="http://www.w3.org/2001/XMLSchema" targetNamespace="http://www.yawlfoundation.org/sb/crewInfo"
	xmlns:tns="http://www.yawlfoundation.org/sb/crewInfo" attributeFormDefault="unqualified"
	elementFormDefault="unqualified">

	<element name="Input_Crew_List" type="tns:Input_Crew_ListType" />

	<complexType name="Input_Crew_ListType">
		<sequence>
			<element name="production" type="string" />	<!--Input Only-->
			<element name="crewInfo" type="tns:crewInfoType" />	<!--Input/Output-->
		</sequence>
	</complexType>

	<complexType name="crewInfoType">
		<sequence>
			<element name="singleCrewInfo" minOccurs="0" maxOccurs="unbounded" type="tns:singleCrewInfoType" />
		</sequence>
	</complexType>

	<complexType name="singleCrewInfoType">
		<sequence>
			<element name="role" type="string" />
			<element name="firstName" type="string" />
			<element name="lastName" type="string" />
			<element name="contactNo" type="string" />
			<element name="email" type="string" />
		</sequence>
	</complexType>
</schema>